acadm_year	acadm_term	authorize_p	authorize_using	chn_name	classes	comment	counter	counter_exceptAuth	course_avg	course_code	course_group	course_kind	credit	dept_chiabbr	dept_code	dept_group_name	eng_name	eng_teach	form_s	limit	limit_count_h	option_code	restrict	rt	serial_no	teacher	time_inf	generalCore
113	2	0	1	管理會計		管理學院 ; 企業管理系 ; 四企二單號 ; 限修學制：大、碩、博	2	1		ABU0758	A	半	3.0	校際臺科大（學）	9UAB		Management Accounting				1	選			5250	張鳳真	二 2-4 TR-615	
113	2	0	0	機器學習暨金融應用	8	管理學院 ; 財務金融研究所 ;   限修學制：碩、博	1	1		ABC8770	A	半	3.0	校際臺科大（碩）	9MAB		Machine Learning and Financial Applications				5	選	◎課程不開放上修		5251	周志隆	二 2-4 IB-601-1	
113	2	0	0	靜力學		工程學院 ; 機械工程系 ; W10演算課，由助教上課 ; 限修學制：大、碩、博	0	0		ABU0996	A	半	3.0	校際臺科大（學）	9UAB		Statics				2	選			5252	吳亦莊	四 8 TR-516, 二 8-9 TR-516, 三 10 TR-516	
113	2	0	2	證券管理		管理學院 ; 企業管理系 ; 開放全校大學部學生選修、限48人 ; 限修學制：大、碩、博	3	1		ABU0718	A	半	3.0	校際臺科大（學）	9UAB		Securities Management				1	選			5253	王耀華	三 A-C IB-501	
113	2	5	4	體育（木球初級）			52	48		00UP136		半	1.0	普通體育	PE		Physical Education (Beginning Woodball)			0	50	必	允許重複修	N	5254	程紹同	三 3-4 公館 操場二	
113	2	0	1	資訊科學導論		文學院 ; 圖書資訊學系 ; 傳播學程學生可修，惟若超額以本系生優先、雙輔本系次之。 ; 限修學制：大、碩、博	1	0		AAU1667	A	半	2.0	校際臺大（學）	9UAA		Introduction to Information Science				0	選	◎加退選全授權碼選課		5255	林奇秀	一 6-7 圖資視聽室	
113	2	0	1	化學工業程序		工學院 ; 化學工程學系 ;   限修學制：大三以上	1	0		AAU2321	A	半	2.0	校際臺大（學）	9UAA		Chemical Process Industries				0	選	◎加退選全授權碼選課		5256	廖英志	五 3-4 信義講堂	
113	2	0	5	十九世紀美國文學		文學院 ; 外國語文學系 ; 英國文學與美國文學九科擇五必修。 ; 限修學制：大、碩、博	5	0		AAU1305	A	半	3.0	校際臺大（學）	9UAA		Nineteenth-century American Literature	是			0	選	◎加退選全授權碼選課		5257	李欣穎	一 2-4 普203	
113	2	0	1	同步輻射相關研究	7	理學院 ; 化學系 ; 外系所學生選修需經授課教師同意。 ; 限修學制：大三以上、大、碩、博	1	0		AAC7E07	A	半	2.0	校際臺大（學）	9UAA		Introduction to Synchrotron Radiation Related Research				0	選	◎加退選全授權碼選課		5258	莊裕鈞	三 6-7 化210室	
113	2	0	1	存活分析		公共衛生學院 ; 健康數據拓析統計研究所 ; 健統所拓析統計進階課程。107學年度起生統組碩博班必選之一。其他系所組學生應經教師同意 ; 限修學制：碩	1	0		AAM0039	A	半	3.0	校際臺大（碩）	9MAA		Survival Analysis				0	選	◎課程不開放上修 ◎加退選全授權碼選課		5259	張淑惠	一 6-8 公衛209	
113	2	0	2	刑法分則		法律學院 ; 法學組 ; 與科法所合開。科法所請選「A41M0210」。 ; 限修學制：大、碩、博	2	0		AAU1411	A	半	4.0	校際臺大（學）	9UAA		Criminal Code-kinds of Offenses				0	選	◎必須先修過刑法總則一】 ◎加退選全授權碼選課		5260	王皇玉	一 8-9 萬2311, 三 3-4 萬2311	
113	2	0	1	兒童讀物		文學院 ; 圖書資訊學系 ;	1	0		AAU1212	A	半	3.0	校際臺大（學）	9UAA		Children's Books				0	選	◎加退選全授權碼選課		5261	劉鳳芯	一 2-4 圖資編目室	
113	2	0	2	館藏發展		文學院 ; 圖書資訊學系 ;   限修學制：大、碩、博	2	0		AAU1522	A	半	3.0	校際臺大（學）	9UAA		Library Collection Development				0	選	◎加退選全授權碼選課		5262	張郁蔚	一 8-10 圖資視聽室	
113	2	0	1	信號與系統		電機資訊學院 ; 電機工程學系 ; 外系學生加選請於加退選時向授課老師詢問。 ; 限修學制：大、碩、博	1	0		AAU2322	A	半	3.0	校際臺大（學）	9UAA		Signals and Systems				3	選	◎加退選全授權碼選課		5263	王鈺強	一 2-4 電二229	
113	2	0	1	物理化學二-量子化學		理學院 ; 化學系 ; 初選不開放，先修科目，詳選課須知。 ; 限修學制：大、碩、博	1	0		AAU1589	A	半	3.0	校際臺大（學）	9UAA		Physical Chemistry (II)--Quantum Chemistry				0	選	◎必須先修過（ 普通化學一 ； 普通化學二 ； 微積分1 ； 微積分2 ； 微積分3 ； 微積分4 ） ｜ （ 普通化學一 ； 普通化學二 ； 微積分甲上 ； 微積分甲下 ） ｜ （ 普通化學一 ； 普通化學二 ； 微積分乙上 ； 微積分乙下 ）】 ◎加退選全授權碼選課 ◎初選不開放		5264	周必泰	二 3-4 化210室, 五 1-2 化210室	
113	2	0	1	電力系統(二)		電資學院 ; 電機工程系 ;   限修學制：大、碩、博	1	0		ABU0997	A	半	3.0	校際臺科大（學）	9UAB		Power Systems (2)				0	選			5265	吳瑞南	一 2-4 IB-308	
113	2	0	1	通報傳染病之檢驗實務	7	公共衛生學院 ; 公共衛生學系 ; 公衛系流行病學與預防醫學領域專長必修。 ;	1	0		AAC7089	A	半	2.0	校際臺大（學）	9UAA		Laboratory Diagnosis of Reportable Diseases in Taiwan				0	選	◎加退選全授權碼選課		5267	施惟量	四 6-7 公衛213	
113	2	0	1	遺傳學		生物資源暨農學院 ; 農藝學系 ; 建議外籍生修課 ;	1	0		AAU1218	D	半	3.0	校際臺大（學）	9UAA		Genetics	是			0	選	◎加退選全授權碼選課		5268	董致韡	一 6 農藝304, 三 3-4 農藝304	
113	2	0	1	演算法		管理學院 ; 管理學士班 ; 限100人、初選限本校管理學士班學生選課，加退選開放外系選課 ; 限修學制：大、碩、博	1	0		ABU0761	B	半	3.0	校際臺科大（學）	9UAB		Algorithms				0	選			5269	楊傳凱	三 2-4 E2-102	
113	2	0	0	數位邏輯設計實習		電資學院 ; 電子工程系 ; 限38人、不分系學號單號 ; 限修學制：大、碩、博	0	0		ABU0756	A	半	1.0	校際臺科大（學）	9UAB		Lab. of Digital Logic Design				1	選			5270	林敬舜	一 10 T2-511, 一 8-9 T2-511	
113	2	0	1	藥物研發趨勢	8	應用科技學院 ; 醫學工程研究所 ; 開放外系研究所選課、加退選開放全校大三、大四選修、限45人、英語授課、EMI課程 ; 限修學制：碩、博	1	0		ABC8771	A	半	2.0	校際臺科大（碩）	9MAB		Trends in Drug Development				5	選	◎課程不開放上修		5271	李典璋	四 3-4 系上安排	
113	2	0	2	物理冶金		工學院 ; 材料科學與工程學系 ;	2	0		AAU2323	A	半	3.0	校際臺大（學）	9UAA		Physical Metallurgy				0	選	◎加退選全授權碼選課		5272	顏鴻威	四 7-9 綜301	
113	2	0	3	王國維人間詞話專題		文學院 ; 中國文學研究所 ;   限修學制：碩	3	0		AAM2290	A	半	3.0	校際臺大（碩）	9MAA		Seminar on Wang Guowei's Renjian Cihua				0	選	◎課程不開放上修 ◎加退選全授權碼選課		5273	劉少雄	三 3-5 博雅311	
113	2	0	1	運動生理學		醫學院 ; 物理治療學系 ;   限修學制：大、碩、博	1	0		AAU2324	A	半	2.0	校際臺大（學）	9UAA		Exercise Physiology				0	選	◎加退選全授權碼選課		5274	王儷穎	一 6-7 物治實習3F	
113	2	0	1	車輛動力學與控制	7	工學院 ; 機械工程學系 ;	1	0		AAC7I33	A	半	3.0	校際臺大（學）	9UAA		Vehicle Dynamics and Control				0	選	◎加退選全授權碼選課		5275	李  綱	二 7-9 新201	
113	2	0	1	普通微生物學		生物資源暨農學院 ; 農業化學系 ;	1	0		AAU1643	A	半	3.0	校際臺大（學）	9UAA		General Microbiology				0	選	◎加退選全授權碼選課		5276	吳蕙芬	一 3-4 農化一第五, 四 1 農化一第五	
113	2	0	1	商事法		管理學院 ; 財務金融學系 ; 先修科目：民法概要乙。 ; 限修學制：大、碩、博	1	0		AAU1973	A	半	3.0	校際臺大（學）	9UAA		Commercial Law				0	選	◎加退選全授權碼選課		5277	陳俊元	二 A-C 管一104	
113	2	0	1	資訊安全導論		管理學院 ; 資訊管理系 ; 限40人、初選限本校資管系學生選課，加退選開放外系選課 ; 限修學制：大、碩、博	1	0		ABU0441	B	半	3.0	校際臺科大（學）	9UAB		Introduction to Information Security				0	選			5278	吳宗成	二 2-4 MA-316	
113	2	0	2	外語習得之量表建立與驗證	8	人文社會學院 ; 應用外語系 ; 限18人、英語授課、限應外系碩士班 ; 限修學制：碩、博	2	0		ABC8574	A	半	3.0	校際臺科大（碩）	9MAB		Scale Construction and Validation in SLA				0	選	◎課程不開放上修		5279	曾文鐽	二 6-8 T4-601-2	
113	2	0	1	資料庫系統		電資學院 ; 資訊工程系 ; 業界師資協同教學 ; 限修學制：大、碩、博	1	0		ABU0998	A	半	3.0	校際臺科大（學）	9UAB		Database Systems				0	選			5280	吳怡樂	五 2 TR-313, 二 8-9 TR-313	
113	2	0	1	莎士比亞喜劇表演專題	7	文學院 ; 戲劇學研究所 ; 初選不開放．須經甄選，方式請見大綱之課程要求欄。有意者均需於第1週上課參加甄試（無需準備），遲到者不得參加。 ; 限修學制：大、碩、博	1	0		AAC7N53	A	半	3.0	校際臺大（學）	9UAA		Topics on Acting for Shakespearean Comedy				2	選	◎加退選全授權碼選課 ◎初選不開放		5281	朱靜美	一 6-8 總一館114	
113	2	0	0	維管束植物形態與演化	7	生命科學院 ; 生態學與演化生物學研究所 ;   限修學制：大、碩、博	1	1		AAC7664	A	半	3.0	校際臺大（學）	9UAA		Morphology and Evolotion of Vascular Plants				2	選			5282	邱少婷	二 6-8 生科3C	
113	2	0	0	彈性力學一		工學院 ; 應用力學研究所 ; 擬進入碩士班就讀之大學部同學可經授課教師同意加選本課程。 ; 限修學制：碩、博	0	0		AAM2291	A	半	3.0	校際臺大（碩）	9MAA		Elasticity (I)	是			1	選	◎課程不開放上修 ◎加退選全授權碼選課		5283	劉佩玲	一 3-4 應111, 三 2 應111	
113	2	0	0	熱電材料	7	工學院 ; 材料科學與工程學研究所 ;   限修學制：大、碩、博	0	0		AAC7N54	A	半	3.0	校際臺大（學）	9UAA		Thermoelectric Materials	是			2	選	◎加退選全授權碼選課		5284	吳欣潔	五 2-4 綜504	
113	2	0	0	工程數學(二)		工程學院 ; 化學工程系 ; 限40人 ; 限修學制：大、碩、博	0	0		ABU0024	C	半	3.0	校際臺科大（學）	9UAB		Engineering Mathematics (2)				0	選			5285	蔡伸隆	五 2 IB-501, 三 3-4 IB-410-1	
113	2	0	0	工業安全衛生法規		管理學院 ; 工業管理系 ;   限修學制：大、碩、博	1	1		ABU0364	A	半	3.0	校際臺科大（學）	9UAB		Industrial Safety and Health Act				2	選			5286	劉立文	一 10-B IB-410-1	
113	2	0	0	生醫光電及其應用	8	工程學院 ; 機械工程系 ; 限25人、加退選開放本系大四選課、加退選開放本系在職專班選課 ; 限修學制：碩、博	0	0		ABC8772	A	半	3.0	校際臺科大（碩）	9MAB		The Technology and Application of Biophotonics				2	選	◎課程不開放上修		5287	陳盈君	一 2-4 E1-470	
113	2	0	0	光學量測	8	工程學院 ; 機械工程系 ; 加退選開放大四選修 ; 限修學制：碩、博	0	0		ABC8773	A	半	3.0	校際臺科大（碩）	9MAB		Optical Measurement				0	選	◎課程不開放上修		5288	謝宏麟	二 5-7 E1-470	
113	2	0	0	車輛控制實務		工程學院 ; 機械工程系 ; 限40人、PBL課程、智慧電動車學程、業界師資協同教學 ; 限修學制：大、碩、博	0	0		ABU0999	A	半	3.0	校際臺科大（學）	9UAB		Vehicle Control Practice				2	選			5289	張以全	一 6-8 E1-223	
113	2	0	0	建築設計(四)		設計學院 ; 建築系 ; 須具備基礎設計繪圖能力力 ; 限修學制：大、碩、博	0	0		ABU0216	B	半	5.0	校際臺科大（學）	9UAB		Architectural-Design(4)				0	選			5290	李萬秋、吳柏翰、陳德仁、陳淑慧、籃元浚、鄭仁杰、陳修兀、李志剛、葉正桃	四 10 RB-708, 四 3-9 RB-708, 二 8-9 RB-809A	
113	2	0	0	策略性企業社會責任	8	管理學院 ; 企業管理系 ; 限20人 ; 限修學制：碩、博	0	0		ABC8774	A	半	3.0	校際臺科大（碩）	9MAB		Strategic Corporate Social Responsibility				1	選	◎課程不開放上修		5291	陳崇文	五 6-8 MA-405	
113	2	0	0	電池概論		工程學院 ; 機械工程系 ; 業界師資協同教學、PBL課程、智慧電動車學程 ; 限修學制：大、碩、博	0	0		ABU1000	A	半	3.0	校際臺科大（學）	9UAB		Introduction to Batteries				5	選			5292	張以全、周宏隆	三 6-8 TR-610	
113	2	0	0	數位邏輯設計		電資學院 ; 電資學士班 ;   限修學制：大、碩、博	0	0		ABU0096	B	半	3.0	校際臺科大（學）	9UAB		Digital Logic Design				0	選			5293	陳勇志	一 5 IB-503, 三 6-7 IB-409-1	
113	2	0	0	鋪面工程	8	工程學院 ; 營建工程系 ; 英語授課、EMI課程 ; 限修學制：碩、博	0	0		ABC8555	A	半	3.0	校際臺科大（碩）	9MAB		Pavement Engineering	是			0	選	◎課程不開放上修		5294	廖敏志	三 2-4 IB-510-2	
113	2	0	0	薄膜結構設計	8	應用科技學院 ; 應用科技研究所 ; 開放外系研究所選課、限55人 ; 限修學制：碩、博	0	0		ABC8657	A	半	3.0	校際臺科大（碩）	9MAB		Design of Membrane Structures				0	選	◎課程不開放上修		5295	洪維松	二 2-4 TR-509	
113	2	0	0	醫學工程專題研究	8	工程學院 ; 機械工程系 ; 加退選開放本系在職專班選課、業界師資協同教學 ; 限修學制：碩、博	0	0		ABC8775	A	半	3.0	校際臺科大（碩）	9MAB		Advanced Studies in Biomedical Engineering				5	選	◎課程不開放上修		5296	陳盈君	二 2-4 E1-470	
113	2	0	1	政治心理學	7	理學院 ; 心理學系 ;	1	0		AAC7L35	A	半	3.0	校際臺大（學）	9UAA		Political Psychology				0	選	◎加退選全授權碼選課		5297	李怡青	二 2-4 北館N206	
113	2	0	1	流行病學		公共衛生學院 ; 公共衛生學系 ; 先修課程：生物統計學一、生物統計學二。本課程有電腦實習課程。 ; 限修學制：大、碩、博	1	0		AAU1601	A	半	3.0	校際臺大（學）	9UAA		Epidemiology				0	選	◎加退選全授權碼選課		5298	郭柏秀	三 2-4 公衛213	
113	2	0	1	普通心理學		理學院 ; 心理學系 ;	1	0		AAU0149	C	半	3.0	校際臺大（學）	9UAA		General Psychology				0	選	◎加退選全授權碼選課		5299	鄧善娟	二 2-4 博雅102	
113	2	0	1	高分子晶體學與自組裝	7	理學院 ; 化學系 ;   限修學制：大三以上、大、碩、博	1	0		AAC7L40	A	半	3.0	校際臺大（學）	9UAA		Polymer Crystallography and Self-Assembly				0	選	◎加退選全授權碼選課		5300	王建隆	二 2-4 化121	
113	2	0	1	資訊科技文類翻譯		文學院 ; 外國語文學系 ; 初選不開放．中英翻譯學程學生優先加選。凡第一週未到課者，不予加選。 ; 限修學制：大、碩、博	1	0		AAU2325	A	半	2.0	校際臺大（學）	9UAA		Translation of IT Texts				1	選	◎加退選全授權碼選課 ◎初選不開放		5301	莊世全	一 6-7 外教104	
113	2	0	1	財經與國際新聞翻譯	7	文學院 ; 翻譯碩士學位學程 ; 翻譯學程學生優先，不開放旁聽，中英翻譯學程學生開學後向教師領取授權碼加選。 ; 限修學制：大、碩、博	1	0		AAC7N55	A	半	2.0	校際臺大（學）	9UAA		Financial and International News Translation				0	選	◎加退選全授權碼選課		5302	潘信宇	三 6-7 博雅311	
113	2	0	1	楚辭學專題討論		文學院 ; 中國文學研究所 ;   限修學制：碩	1	0		AAM2292	A	半	3.0	校際臺大（碩）	9MAA		Seminar on the Interpretation and Influence of Chu Ci				0	選	◎課程不開放上修 ◎加退選全授權碼選課		5303	吳旻旻	五 3-5 博雅311	
113	2	0	1	使用者導向創新設計	8	設計學院 ; 設計系 ; 限20人 ; 限修學制：碩、博	1	0		ABC8776	A	半	3.0	校際臺科大（碩）	9MAB		User-Oriented Innovative Design				0	選	◎課程不開放上修		5304	唐玄輝	三 2-4 E2-324	
113	2	0	5	網頁設計		設計學院 ; 設計系 ; 限30人、限設計系學生修讀. ; 限修學制：大、碩、博	5	0		ABU0358	A	半	3.0	校際臺科大（學）	9UAB		Web Page Design				0	選			5305	楊振	三 A-C E2-318	
113	2	0	0	系統識別		工學院 ; 機械工程學研究所 ;   限修學制：大、碩、博	0	0		AAM1428	A	半	3.0	校際臺大（碩）	9MAA		System Identification	是			5	選	◎課程開放上修 ◎加退選全授權碼選課		5306	李宇修	四 2-4 機械116	
113	2	0	0	資訊傳播專題	7	文學院 ; 圖書資訊學系 ; U選課程，學士班與碩士班學生均可修習。 ;	0	0		AAC7N56	A	半	3.0	校際臺大（學）	9UAA		Seminar on Information and Communication System				0	選	◎加退選全授權碼選課		5307	林維真	五 2-4 圖資視聽室	
113	2	0	0	人工智慧應用		管理學院 ; 企業管理系 ; 四企三單號、業界師資協同教學 ; 限修學制：大、碩、博	1	1		ABU0795	A	半	3.0	校際臺科大（學）	9UAB		Applications of Artificial Intelligence				1	選			5308	林筱玫、欒斌	二 2-4 MA-519	
113	2	0	0	創意性機構設計	8	工程學院 ; 機械工程系 ; 加退選時開放本系大四選課、限20人、加退選開放本系在職專班選課、業界師資協同教學 ; 限修學制：碩、博	0	0		ABC8460	A	半	3.0	校際臺科大（碩）	9MAB		Creative Mechanism Design				4	選	◎課程不開放上修		5309	陳羽薰	二 6-8 TR-616	
113	2	0	0	結構學		工程學院 ; 先進科技全英語外國學生專班 ; EMI課程、先修課程:材料力學、英語授課、請自行上機選課 ; 限修學制：大、碩、博	0	0		ABU0078	A	半	3.0	校際臺科大（學）	9UAB		Structural Analysis	是			0	選	◎必須先修過材料力學】		5310	Marnie	二 1-2 IB-409-2, 三 6 IB-408	
113	2	0	0	電腦輔助設計(二)		設計學院 ; 設計系 ; 限30人、限商設組學號雙號修讀 ; 限修學制：大、碩、博	0	0		ABU0586	A	半	3.0	校際臺科大（學）	9UAB		Computer Aided Design (2)				0	選			5311	孫春望	五 A-C RB-403	
113	2	0	0	環境控制系統(一)		設計學院 ; 建築系 ; 四建二甲 ; 限修學制：大、碩、博	0	0		ABU0104	B	半	3.0	校際臺科大（學）	9UAB		Environmental Control System (1)				0	選			5312	詹肇裕	三 6-8 TR-515	
113	2	0	1	複解析幾何專題	7	理學院 ; 數學系 ;	1	0		AAC7N57	A	半	3.0	校際臺大（學）	9UAA		Topics in complex analytic geometry				0	選	◎加退選全授權碼選課		5313	蕭欽玉	二 6-8 天數302	
113	2	0	1	重複測量統計分析	7	公共衛生學院 ; 公共衛生學系 ; 公衛系生物統計與健康資訊領域專長必修。歡迎大學部高年級生選修。 ; 限修學制：大、碩、博	1	0		AAC7057	A	半	2.0	校際臺大（學）	9UAA		Statistical Analysis for Repeated Measurements				0	選	◎加退選全授權碼選課		5314	林菀俞	四 6-7 公衛214	
113	2	0	1	教材與活動設計	8	人文社會學院 ; 應用外語系 ; 限18人、英語授課、EMI課程、限應外系碩士班、業界師資協同教學 ; 限修學制：碩、博	1	0		ABC8777	A	半	3.0	校際臺科大（碩）	9MAB		Curriculum Design	是			0	選	◎課程不開放上修		5315	駱藝瑄	四 2-4 T4-407	
113	2	0	1	智慧車輛設計與實務二	7	工學院 ; 機械工程學系 ; 上課地點:機械館114教室。 ;	1	0		AAC7E90	A	半	3.0	校際臺大（學）	9UAA		Design and Practice of Intelligent Vehicles(II)				0	選	◎加退選全授權碼選課		5316	詹魁元	四 7-9	
113	2	0	1	線性代數		管理學院 ; 資訊管理學系 ; 週二6實習課。 ; 限修學制：大、碩、博	1	0		AAU2080	A	半	3.0	校際臺大（學）	9UAA		Linear Algebra	是			0	選	◎加退選全授權碼選課		5318	李家岩	二 6 管一101, 四 2-4 管一101	
113	2	0	0	大地工程實務	7	工學院 ; 土木工程學研究所 ;   限修學制：大、碩、博	0	0		AAC7I13	A	半	3.0	校際臺大（學）	9UAA		Geotechnical Engineering Practice	是			5	選	◎加退選全授權碼選課		5319	謝旭昇	四 2-4 土224	
113	2	0	1	心理統計學下		理學院 ; 心理學系 ; 心理系學生限修此班。 ; 限修學制：大、碩、博	1	0		AAU2148	A	半	3.0	校際臺大（學）	9UAA		Psychological Statistics (2)				0	選	◎必須先修過心理及教育統計學上 ｜ 心理統計學上】 ◎加退選全授權碼選課		5320	姚開屏	五 2-4 北館視聽	
113	2	0	1	刑法總則二		法律學院 ; 法律學系 ; 與科法所合班。科法所請選A41M0240。與刑總一係連貫之課程，需修習相同之班次，不得變換班次。 ; 限修學制：大、碩、博	1	0		AAU0396	B	半	3.0	校際臺大（學）	9UAA		Criminal Code-general Principles (II)				1	選	◎必須先修過刑法總則一】 ◎加退選全授權碼選課		5321	許?達	三 2-4 萬2201	
113	2	0	0	成癮行為：成因、評估與管制	7	公共衛生學院 ; 健康行為與社區科學研究所 ;   限修學制：大三以上、碩、博	1	1		AAC7N58	A	半	2.0	校際臺大（學）	9UAA		Addictive Behaviors: Etiology, Evaluation, and Regulation				1	選			5322	翁書偉	一 6-7 公衛211	
113	2	0	0	固態電子學		電機資訊學院 ; 電機工程學系 ;   限修學制：大、碩、博	1	1		AAU1716	A	半	3.0	校際臺大（學）	9UAA		Solid State Electronics	是			2	選			5323	胡璧合	三 6-8 電二106	
113	2	0	0	森林療癒概論	7	生物資源暨農學院 ; 森林環境暨資源學研究所 ; 資源保育及管理學群選擇必修 ; 限修學制：大、碩、博	0	0		AAC7857	A	半	3.0	校際臺大（學）	9UAA		Introduction to Forest Therapy				4	選	◎加退選全授權碼選課		5324	余家斌	四 2-4 林一	
113	2	0	1	森林療癒與身心健康	7	生物資源暨農學院 ; 森林環境暨資源學研究所 ;   限修學制：大、碩、博	1	0		AAC7N59	A	半	3.0	校際臺大（學）	9UAA		Forest Therapy and Wellness				4	選	◎加退選全授權碼選課		5325	余家斌	四 6-8 新302	
113	2	0	0	立體造形		設計學院 ; 設計系 ; 限30人、限商設組學號雙號修讀 ; 限修學制：大、碩、博	0	0		ABU0561	A	半	2.0	校際臺科大（學）	9UAB		Formation				0	選			5326	林俊傑	一 6-8 IB-601-2	
113	2	0	0	信號與系統		電資學院 ; 電機工程系 ; 必修十選四、英語授課、EMI課程 ; 限修學制：大、碩、博	0	0		ABU1001	A	半	3.0	校際臺科大（學）	9UAB		Signals and Systems	是			0	選			5327	黃騰毅	一 4 IB-410-1, 三 6-7 IB-410-1	
113	2	0	0	高等財務管理	8	管理學院 ; 財務金融研究所 ; 國外學者密集授課、英語授課、EMI課程、遴選不開放選修、2/18至5/20密集上課 ; 限修學制：碩、博	0	0		ABC8778	A	半	3.0	校際臺科大（碩）	9MAB		Advanced Financial Management	是			5	選	◎課程不開放上修		5328	林鑒廷	四 A-C IB-512, 二 A-C IB-512	
113	2	0	0	商業攝影		設計學院 ; 設計系 ; 限25人、限設計系及不分系主修設計學生 ; 限修學制：大、碩、博	0	0		ABU0889	A	半	2.0	校際臺科大（學）	9UAB		Commercial Photography				0	選			5329	鄧博仁	三 6-9 T2-307	
113	2	0	0	智慧照明系統與照明燈具設計	8	電資學院 ; 電機工程系 ; 加退選時開放本系大四選課 ; 限修學制：碩、博	0	0		ABC8656	A	半	3.0	校際臺科大（碩）	9MAB		Intelligent Lighting System and Lighting Fixture Design				0	選	◎課程不開放上修		5330	蕭弘清	五 2-4 EE-407	
113	2	0	1	生態學		生物資源暨農學院 ; 生物環境系統工程學系 ; 非生工系一年級學生有修課需求，請於開學後向教師索取加簽授權碼。 ; 限修學制：大、碩、博	1	0		AAU0044	B	半	3.0	校際臺大（學）	9UAA		Ecology	是			0	選	◎加退選全授權碼選課		5331	任秀慧	五 7-9 共104	
113	2	0	1	環境政策與管理		工學院 ; 環境工程學研究所 ;	1	0		AAM2293	A	半	2.0	校際臺大（碩）	9MAA		Environmental Policy and Management				0	選	◎課程不開放上修 ◎加退選全授權碼選課		5332	馬鴻文	五 3-4 環工101	
113	2	0	1	有機金屬化學	7	理學院 ; 化學系 ;   限修學制：大三以上、大、碩、博	1	0		AAC7008	A	半	2.0	校際臺大（學）	9UAA		Organometallic Chemistry				0	選	◎加退選全授權碼選課		5333	江建文	五 6-7 化217	
113	2	0	1	環境衛生學		公共衛生學院 ; 公共衛生學系 ;   限修學制：大、碩、博	1	0		AAU1706	A	半	2.0	校際臺大（學）	9UAA		Environmental Health				0	選	◎加退選全授權碼選課		5334	蔡詩偉	四 3-4 公衛215	
113	2	0	2	佛教藝術研究問題方法		文學院 ; 藝術史研究所 ;   限修學制：碩	2	0		AAM2294	A	半	3.0	校際臺大（碩）	9MAA		Problems and Methods in Buddhist Art Studies				0	選	◎課程不開放上修 ◎加退選全授權碼選課		5335	巫佩蓉	五 6-8 樂學205	
113	2	0	1	明清戲曲中的性∕別與表演		文學院 ; 中國文學研究所 ; 初選不開放，2月21日週五第7節於中文系研討室辦理說明會，有意修課同學請務必出席，會中發放授權碼供同學選課。 ; 限修學制：碩	1	0		AAM2295	A	半	1.0	校際臺大（碩）	9MAA		Sex/Gender and Performance in the Ming-Qing Drama				0	選	◎課程不開放上修 ◎加退選全授權碼選課 ◎初選不開放		5336	汪詩珮	五 7-9 中文研討	
113	2	0	1	國際生初級臺語	7	文學院 ; 華語教學碩士學位學程 ; 交換生、訪問生優先選課。 ; 限修學制：大、碩、博	1	0		AAC7N60	A	半	2.0	校際臺大（學）	9UAA		Basic Taiwanese				0	選	◎加退選全授權碼選課		5337	陳豐惠	三 8-9 共307	
