acadm_year	acadm_term	authorize_p	authorize_using	chn_name	classes	comment	counter	counter_exceptAuth	course_avg	course_code	course_group	course_kind	credit	dept_chiabbr	dept_code	dept_group_name	eng_name	eng_teach	form_s	limit	limit_count_h	option_code	restrict	rt	serial_no	teacher	time_inf	generalCore
114	2	9	0	環境倫理與永續發展 </br>[ 學分學程：理工實作學程 ]			22	22		06UG006	B	半	2.0	通識	GU		Environmental Ethics and Sustainable Development </br>[ Program: The Program of STEM Innovation and Practices ]			0	90	通		N	1000	李清安	三 A-B 和平 誠201	A3UG
114	2	4	0	資訊科技與生活 </br>[ 學分學程：高齡學程 ]			50	50		06UG012	A	半	2.0	通識	GU		Information Technology and the Way of Life </br>[ Program: The program of Cultivating Seniors Service Talent in Community ]			0	50	通		N	1001	劉建成	一 3-4 和平 誠104	A4UG
114	2	4	0	資訊科技與生活 </br>[ 學分學程：高齡學程 ]			50	50		06UG012	B	半	2.0	通識	GU		Information Technology and the Way of Life </br>[ Program: The program of Cultivating Seniors Service Talent in Community ]			0	50	通		N	1002	劉建成	一 6-7 和平 誠104	A4UG
114	2	10	0	科技與人文的對話		最營養的通識課，包山包海，保證收穫滿滿。	90	90		06UG014		半	2.0	通識	GU		Dialogue between Technology and Humanity			0	100	通		N	1003	王銀國	三 3-4 和平 誠101	A3UG
114	2	3	0	疾病、醫學與文明			88	88		06UG016		半	2.0	通識	GU		Diseases, Medicine and Civilization			0	115	通		N	1004	梁至中	二 6-7 和平 教202會議廳	A3UG
114	2	0	0	學習與生活中的腦科學 </br>[ 學分學程：理工實作學程 ]			51	51		06UG018	A	半	2.0	通識	GU		Brain Science in Learning and Daily Life </br>[ Program: The Program of STEM Innovation and Practices ]			0	75	通		N	1005	顏妙璇	一 3-4 公館 理圖003	A3UG
114	2	0	0	學習與生活中的腦科學 </br>[ 學分學程：理工實作學程 ]			53	53		06UG018	B	半	2.0	通識	GU		Brain Science in Learning and Daily Life </br>[ Program: The Program of STEM Innovation and Practices ]			0	75	通		N	1006	顏妙璇	一 6-7 公館 理圖003	A3UG
114	2	9	0	宇宙中的生命與太空環境 </br>[ 學分學程：天文重力學程 ]		◎數位課程 All distance learning courses display synchronous learning and face-to-face learning time only.	28	28		06UG021		半	2.0	通識	GU		Life in the Universe and the Space Environments </br>[ Program: The Program of  Astronomy and Gravitation ]	是		30	97	通		1	1007	橋本康弘	◎面授/同步	A3UG
114	2	10	0	日常生活藥理學			29	29		06UG029		半	2.0	通識	GU		Pharmacology of Daily Life	是		0	50	通		N	1008	呂國棟	五 3-4 公館 理圖002	A3UG
114	2	5	0	客庄產業中的科學		◎客語      授課 全客語授課	5	5		06UG034		半	2.0	通識	GU		Science of Industry in Hakka Villages			0	50	通		N	1009	宋蕙伶	二 6-7 和平 正202	A3UG
114	2	0	0	心理學 </br>[ 學分學程：藝教學程 人社學程 肌力與體能學程 音樂輔教學程 ]		中文授課。	60	60		0AUG402		半	2.0	通識	GU		Psychology </br>[ Program: The Program of Art Education Therapy Human Services and Social Work Credit Program The Program of Strength and Conditioning The Program of Music-assisted Guidance and Special Education ]			0	60	通		N	1010	楊諮燕	四 3-4 和平 誠203	A2UG/B1UG
114	2	10	0	健康與生活			60	60		0AUG408		半	2.0	通識	GU		Health and Life			5	60	通		N	1011	黃玫瑄	四 3-4 和平 教202會議廳	A3UG
114	2	0	0	聖經與人生			50	50		0AUG442		半	2.0	通識	GU		The Bible and Human Life	是		0	50	通		N	1012	范俊銘	一 C-D 公館 Ｓ204	A1UG
114	2	10	0	個人投資理財			170	170		0AUG462	A	半	2.0	通識	GU		Personal Finance			0	170	通		N	1013	朱文增	三 3-4 和平 綜202演講廳	A2UG
114	2	10	0	個人投資理財			117	117		0AUG462	B	半	2.0	通識	GU		Personal Finance			0	140	通		N	1014	廖仁傑	三 8-9 和平 誠101	A2UG
114	2	10	0	休閒與生活 </br>[ 學分學程：肌力與體能學程 ]			50	50		0AUG463		半	2.0	通識	GU		Leisure in Our Daily Life </br>[ Program: The Program of Strength and Conditioning ]			0	50	通		N	1015	李晶	三 3-4 和平 誠203	A2UG
114	2	3	0	學術寫作			7	7		0HUG011		半	2.0	通識	GU		Academic Writing			1	50	通		N	1016	謝秀卉	二 3-4 和平 正201	A1UG
114	2	5	0	閩南語概論			38	38		0HUG210		半	2.0	通識	GU		Introduction to Southern Min Chinese			0	50	通	◎國文系（學）不得選修	N	1017	林香薇	五 3-4 和平 樸304	A1UG
114	2	10	0	禪與人生			10	10		0HUG223		半	2.0	通識	GU		Chan and Life			0	50	通	◎國文系（學）不得選修	N	1018	黃敬家	三 8-9 和平 誠102	A2UG
114	2	10	0	中國文學欣賞			20	20		0HUG252		半	2.0	通識	GU		The Appreciation of Chinese Literatures			0	50	通	◎國文系（學）不得選修	N	1019	林淑雲	一 6-7 和平 誠307	A1UG
114	2	10	0	莎士比亞的故事			31	31		0HUG432		半	2.0	通識	GU		Shakespeare			0	70	通		N	1020	蘇子中	二 6-7 和平 誠202	A1UG/B2UG
114	2	5	0	國際貿易英文		第一週上課抽籤，高年級優先。母語為英語者， 煩請勿選此課。	33	33		0HUG449		半	2.0	通識	GU		English for International Trade			0	50	通		N	1021	田正利	二 3-4 和平 正202	A1UG
114	2	5	0	日語（一）		1.日語母語者不可修本課程  2.不接受旁聽  3.只限三校聯盟選課。	60	60		0HUG501	A	半	2.0	通識	GU		Beginning Japanese			0	60	通		N	1022	張怡倩	二 3-4 公館 理圖001	A1UG
114	2	0	0	日語（一）		(1)日語為母語者不可選課。(2)本課程不開放授權碼，亦不簽停修單。	50	50		0HUG501	B	半	2.0	通識	GU		Beginning Japanese			0	50	通		N	1023	許菁娟	三 6-7 和平 正202	A1UG
114	2	5	0	西班牙語（一） </br>[ 學分學程：國關與外交學程 ]		母語人士不可選課。	50	50		0HUG503		半	2.0	通識	GU		Spanish (I) </br>[ Program: The Program of International Relations and Diplomacy ]			0	50	通		N	1024	張乃翠	三 3-4 和平 正204	A1UG
114	2	5	0	西班牙語（二）		母語人士不可選課。	16	16		0HUG504		半	2.0	通識	GU		Spanish (II)			0	50	通		N	1025	張乃翠	三 6-7 和平 正204	A1UG
114	2	5	0	法語（二）		需修過法文一或學過30小時以上法文。	18	18		0HUG505		半	2.0	通識	GU		French (II)			0	50	通		N	1026	李曉芸	三 6-7 和平 正301	A1UG
114	2	5	0	韓語（一）		1.韓語為母語者不可選課。2.授權碼發放以大四或延畢同學為優先。	46	46		0HUG506		半	2.0	通識	GU		Korean (I)			0	50	通		N	1027	魯水晶	二 3-4 公館 理圖002	A1UG
114	2	5	0	泰國語言與文化		母語人士不可選課。	17	17		0HUG507		半	2.0	通識	GU		Thai Language and Culture			0	50	通		N	1028	譚華德	四 6-7 和平 樸306	A1UG
114	2	5	0	泰語（二）		母語人士不可選課。	0	0		0HUG510		半	2.0	通識	GU		Thai Language (II)			0	50	通		N	1029	譚華德	四 8-9 和平 樸306	A1UG
114	2	0	0	歷史與電影			38	38		0HUG634		半	2.0	通識	GU		History and the Movies			0	100	通		N	1030	陳佳宏	五 3-4 和平 誠201	A1UG
114	2	0	0	越南語（一） </br>[ 學分學程：國關與外交學程 ]		母語人士不可選課。	5	5		0HUG649		半	2.0	通識	GU		Vietnamese (I) </br>[ Program: The Program of International Relations and Diplomacy ]			0	50	通		N	1031	劉陳石草	三 A-B 和平 誠208	A1UG
114	2	0	0	越南語（二）		母語人士不可選課。	7	7		0HUG650		半	2.0	通識	GU		Vietnamese (II)			0	50	通		N	1032	劉陳石草	四 A-B 和平 誠107	A1UG
114	2	5	0	韓語（二）		1.韓語為母語者不可選課。2.授權碼發放以大四或延畢同學為優先。	23	23		0HUG651		半	2.0	通識	GU		Korean (II)			0	50	通		N	1033	魯水晶	二 6-7 公館 理圖002	A1UG
114	2	5	0	日語（二）		1.日語母語者不可修本課程  2.不接受旁聽  3.只限三校聯盟選課。	36	36		0HUG652	A	半	2.0	通識	GU		Japanese (II)			0	60	通		N	1034	張怡倩	二 6-7 公館 理圖001	A1UG
114	2	5	0	日語（二）		1.日語母語者不可修本課程  2.不接受旁聽  3.只限三校聯盟選課。	16	16		0HUG652	B	半	2.0	通識	GU		Japanese (II)			0	60	通		N	1035	張怡倩	二 8-9 公館 理圖001	A1UG
114	2	0	0	日語（二）		(1)日語為母語者不可選課。(2)本課程不開放授權碼，亦不簽停修單。	19	19		0HUG652	C	半	2.0	通識	GU		Japanese (II)			0	50	通		N	1036	許菁娟	三 8-9 和平 正202	A1UG
114	2	0	0	日語（二）		(1)日語為母語者不可選課。(2)本課程不開放授權碼，亦不簽停修單。	23	23		0HUG652	D	半	2.0	通識	GU		Japanese (II)			0	50	通		N	1037	許菁娟	一 8-9 和平 正202	A1UG
114	2	0	0	日語（二）		(1)日語為母語者不可選課。(2)本課程不開放授權碼。僅限三校聯盟學生旁聽 (需來信詢問)	30	30		0HUG652	E	半	2.0	通識	GU		Japanese (II)			0	50	通		N	1038	簡嘉菁	二 3-4 和平 樸202	A1UG
114	2	5	0	印尼語（一） </br>[ 學分學程：國關與外交學程 ]		印尼語為母語者，或印尼及馬來西亞國籍者不得修課。	8	8		0HUG653		半	2.0	通識	GU		Indonesian Language (I) </br>[ Program: The Program of International Relations and Diplomacy ]			0	50	通		N	1039	馮燕妮	二 3-4 和平 正301	A1UG
114	2	5	0	印尼語（二）		印尼語為母語者，或印尼及馬來西亞國籍者不得修課。	3	3		0HUG654		半	2.0	通識	GU		Indonesian Language (II)			0	50	通		N	1040	馮燕妮	二 6-7 和平 正301	A1UG
114	2	0	0	馬來語 （一）		馬來西亞籍及印尼籍同學不得修習與旁聽。旁聽者需提前知會講師。	13	13		0HUG655		半	2.0	通識	GU		Malay Language (I)			0	50	通		N	1041	陳際宇	一 9-10 和平 誠304	A1UG
114	2	0	0	馬來語 （二）		馬來西亞籍及印尼籍同學不得修習與旁聽。旁聽者需提前知會講師。	14	14		0HUG656		半	2.0	通識	GU		Malay Language (II)			0	50	通		N	1042	陳際宇	一 A-B 和平 誠304	A1UG
114	2	22	0	３Ｄ列印與創新應用			80	80		0NUG253		半	2.0	通識	GU		3 D Printing and Innovative Applications			0	80	通		N	1043	沈林琥	三 3-4 和平 誠102	A3UG
114	2	2	0	臺灣原住民社會發展 </br>[ 學分學程：原民教育學程 ]			30	30		0SUG411		半	2.0	通識	GU		Social Development of Taiwan Aborigines </br>[ Program: The Program of Indigenous Education and Culture ]			1	50	通		N	1044	汪明輝	三 3-4 和平 誠107	A2UG
114	2	10	0	博物館探索			57	57		0SUG514		半	2.0	通識	GU		Exploration of Museum			5	60	通		N	1045	黃玫瑄	三 6-7 和平 誠301	A2UG
114	2	0	0	通識教育講座			59	59		0SUG523	A	半	2.0	通識	GU		Lectures on General Education			0	75	通		N	1046	鄭怡庭	三 3-4 和平 誠301	A2UG
114	2	16	0	通識教育講座		本課程為寒假密集上課之全英語課程。上課（含考試）期間為2026年1月20日至1月30日。請修課同學如期到課。  本校學生請於114-2第一階段選課期間（2026/1/6~1/9）自行於選課系統選課。  臺大系統學生請於開學後加退選期間，經由原校選課系統以授權碼方式選課。    其他校際生及旁聽選讀生（包含社會人士）請於本校公告期程內（115/2/9~3/9）依規定選課。	64	64		0SUG523	B	半	2.0	通識	GU		Lectures on General Education	是		0	160	通	◎第二階段需人工加選 ◎加退選全授權碼選課	N	1047	劉以德	◎密集課程	A2UG
114	2	0	0	自主學習：自主探究		已選課或欲選課者，第一週必須出席課堂；並於期限前繳交計畫書或第一周至課堂繳交，否則請務必退選或勿再加選。	8	8		0SUG542		半	2.0	通識	GU		Self-Directed Learning: Guided Study			1	50	通		N	1048	未定	三 A-B 和平 誠307	C1UG
114	2	0	0	冒險觀光概論			21	21		0SUG543		半	2.0	通識	GU		Introduction to Adventure Tourism	是		0	30	通		N	1049	王伯宇	二 3-4 和平 誠401	A2UG
114	2	5	0	職涯規劃與發展			42	42		0SUG544		半	2.0	通識	GU		Career Planning and Development			0	50	通		N	1050	林怡君	四 6-7 和平 正202	B3UG
114	2	10	0	職場倫理	9		22	22		H5C9001		半	2.0	科技學院	H		Career Ethics			0	50	選		N	1051	張敬珣	三 3-4 和平 科技系TB212教室	
114	2	10	0	技職教育政策與法規研究			3	3		IED0069		半	2.0	工教系（博）	HD70		Studies in Policy and Law of Technological and Vocational Education	是		0	50	選	◎課程開放上修	N	1052	胡茹萍	二 3-4 和平 研討四	
114	2	10	0	亞太地區技職教育專題			2	2		IED0089		半	2.0	工教系（博）	HD70		Special Topics in Technical Vocational Education of Asia-Pacific Area			0	50	選	◎課程開放上修	N	1053	宋修德	五 7-8 和平 研討四	
114	2	10	0	技職教育行政與視導			12	12		IED0092		半	2.0	工教系（博）	HD70		Technical-Vocational Education Administration and Supervision	是		0	50	選	◎課程開放上修	N	1054	胡茹萍	二 5-6 和平 研討四	
114	2	10	0	書報討論（四）			7	7		IED0112		半	1.0	工教系（博）	HD70		Seminar (IV)	是		0	50	必	◎課程開放上修	N	1055	胡茹萍	二 2 和平 研討四	
114	2	10	0	書報討論（二）			4	4		IED0118		半	1.0	工教系（博）	HD70		Seminar (II)	是		0	50	必	◎課程開放上修	N	1056	曾璧光	二 2 和平 研討一	
114	2	10	0	技職教育行政數位化專題研究			5	5		IED0122		半	2.0	工教系（博）	HD70		Special Topics in Digitalized Administration of Technical-Vocational Education			0	50	選	◎課程開放上修	N	1057	郭金國	一 6-7 和平 研討三	
114	2	10	0	技職教育課程發展專題研究			11	11		IED0125		半	2.0	工教系（博）	HD70		Special Topics in Technical-Vocational Education Curriculum Development			0	50	選	◎課程開放上修	N	1058	宋修德	二 7-8 和平 研討四	
114	2	10	0	技職教育評鑑專題研究			6	6		IED0128		半	2.0	工教系（博）	HD70		Studies in Assessment of Technological Vocational Education	是		0	50	選	◎課程開放上修	N	1059	李懿芳	二 3-4 和平 研討一	
114	2	5	0	組織發展專題研究			2	2		ITD0020		半	3.0	科技系（博）	HD71		Special Topics in Organizational Development			1	30	選	◎限本系(含雙主修)修習 ◎課程開放上修	N	1060	張敬珣	四 2-4 和平 科技系TB312教室	
114	2	5	0	書報討論（二）			8	8		ITD0039		半	2.0	科技系（博）	HD71		Seminar (II)			0	30	必	◎限本系(含雙主修)修習   ◎限博二博三博四博五以上修習 ◎課程不開放上修	N	1061	張基成	五 7-8 和平 科技系TA513教室	
114	2	5	0	科技與工程教育哲學思潮專題研究			2	2		ITD0040		半	3.0	科技系（博）	HD71		Special Topics on Philosophy of Technology and Engineering Education			3	30	選	◎限本系(含雙主修)修習 ◎課程不開放上修	N	1062	張基成	五 2-4 和平 科技系TA513教室	
114	2	5	0	科技與工程教育教學專題研究			5	5		ITD0041		半	3.0	科技系（博）	HD71		Special Topics on Instruction in Technology and Engineering Education			0	30	選	◎限本系(含雙主修)修習 ◎課程不開放上修	N	1063	黃能堂	四 7-9 和平 科技系TA513教室	
114	2	10	0	工業教育研究法（二）			27	27		IEM0084		半	2.0	工教系（碩）	HM70		Research Methods in Industrial Education (II)			0	50	必	◎課程開放上修	N	1066	詹育	二 3-4 和平 研討二	
114	2	10	0	高等教育統計學（一）		◎數位課程 僅顯示同步遠距及面授時間	29	29		IEM0095		半	2.0	工教系（碩）	HM70		Advanced Educational Statistics (I)			0	50	必	◎課程開放上修	1	1067	李懿芳	◎面授/同步	
114	2	10	0	電腦化測驗與評量系統			6	6		IEM0145		半	3.0	工教系（碩）	HM70		Computerized Testing and Evaluation System			0	50	選	◎課程開放上修	N	1068	詹育	四 5-7 和平 研討四	
114	2	10	0	書報討論－技職教育（二）			10	10		IEM0178		半	1.0	工教系（碩）	HM70		Seminar on Vocational Technical (II)			0	50	必	◎課程開放上修	N	1069	詹育	三 7 和平 研討四	
114	2	10	0	技職教育理論與實務			9	9		IEM0179		半	2.0	工教系（碩）	HM70		Theories and Methods in Vocational Technical Education			0	50	必	◎課程開放上修	N	1070	曾璧光	二 8-9 和平 研討六	
114	2	10	0	奈米材料工程			2	2		IEM0319		半	3.0	工教系（碩）	HM70		Engineering of Nanomaterials			0	50	選	◎課程開放上修	N	1071	郭金國	五 6-8 和平 研討一	
114	2	10	0	書報討論－技職教育（四）			10	10		IEM0378		半	1.0	工教系（碩）	HM70		Seminar on Vocational Technical(IV)			0	50	必	◎課程開放上修	N	1072	曾璧光	三 8 和平 研討一	
114	2	10	0	書報討論－科技應用管理（四）			13	13		IEM0388		半	1.0	工教系（碩）	HM70		Seminar on Technological Application Management(IV)			0	50	必	◎課程開放上修	N	1073	陳麗妃	三 8 和平 研討二	
114	2	10	0	書報討論－科技應用管理（二）			15	15		IEM0396		半	1.0	工教系（碩）	HM70		Seminar on Technological Application Management(II)			0	50	必	◎課程開放上修	N	1074	蘇友珊	三 7 和平 研討五	
114	2	10	0	技職教育課程發展研究			7	7		IEM0410		半	2.0	工教系（碩）	HM70		Curriculum Development of Technical-Vocational Education			0	50	選	◎課程開放上修	N	1075	曾璧光	二 10-A 和平 研討四	
114	2	10	0	技職教育學習理論研究	8		1	1		IEC0003		半	2.0	工教系（碩）	HM70		Studies in Learning Theory of Technological and Vocational Education	是		0	50	選	◎課程開放上修	N	1076	宋修德	五 9-10 和平 研討四	
114	2	10	0	多變項統計分析	8		8	8		IEC0014		半	2.0	工教系（碩）	HM70		Statistical Methods for Multivariate Analysis	是		0	50	必	◎課程開放上修	N	1077	李懿芳	二 9-10 和平 研討二	
114	2	10	0	數位學習環境設計	8		9	9		IEC0026		半	3.0	工教系（碩）	HM70		Digital Learning Environment Design			0	50	選	◎課程開放上修	N	1078	周明	三 A-C 和平 研討八	
114	2	10	0	人力資源管理專題研究	8		4	4		IEC8001		半	2.0	工教系（碩）	HM70		Special Topics in Human Resource Management			0	50	選	◎課程開放上修	N	1079	陳麗妃	五 A-B 和平 研討一	
114	2	10	0	組織創新發展研究	8		14	14		IEC8003		半	2.0	工教系（碩）	HM70		Organization Innovation and Development			0	50	選	◎課程開放上修	N	1080	蘇友珊	一 3-4 和平 研討五	
114	2	10	0	想像力與創造力應用於技職教育專題研究	8		15	15		IEC8004		半	2.0	工教系（碩）	HM70		Special Topics in Creative Thinking and Innovation of Technical-Vocational Education			0	50	選	◎課程開放上修	N	1081	周明	二 A-B 和平 研討八	
114	2	10	0	決策理論與分析	8		6	6		IEC8009		半	3.0	工教系（碩）	HM70		Decision Theory and Analysis			3	50	選	◎課程開放上修	N	1082	陳麗妃	五 6-8 和平 研討二	
114	2	10	0	科技與方法論	8		14	14		IEC8015		半	3.0	工教系（碩）	HM70		Technology and Methodology			0	50	選	◎課程開放上修	N	1083	周明	一 A-C 和平 研討八	
114	2	5	0	人力資源發展課程設計研究			17	17		ITM0055		半	3.0	科技系（碩）	HM71		Studies in Curriculum Design for Human Resource Development			0	30	選	◎限本系(含雙主修)修習 ◎課程不開放上修	N	1084	陳淑媛	一 7-9 和平 科技系TA513教室	
114	2	5	0	智慧型網路教學系統			6	6		ITM0072		半	3.0	科技系（碩）	HM71		Intelligent Web-based Instruction System			0	30	選	◎限本系(含雙主修)修習 ◎課程不開放上修	N	1085	許庭嘉	四 7-9 和平 科技系TA509教室	
114	2	5	0	網路教育與訓練研究			13	13		ITM0080		半	3.0	科技系（碩）	HM71		Studies in Teaching and Training of Online Learning	是		3	30	選	◎限本系(含雙主修)修習 ◎課程開放上修	N	1086	嚴萬軒	三 2-4 和平 科技系TA509教室	
114	2	5	0	網路輔助學習系統研究		本課程適合已經擁有 Python 程式語言基礎者選修。	9	9		ITM0081		半	3.0	科技系（碩）	HM71		Studies in Network-aided Learning Systems	是		3	30	選	◎限本系(含雙主修)修習 ◎課程開放上修	N	1087	蔡芸琤	一 2-4 和平 科技系TB311教室	
114	2	5	0	教具設計研究			11	11		ITM0087		半	3.0	科技系（碩）	HM71		Study in Teaching Aids Design			0	30	選	◎限本系(含雙主修)修習 ◎課程開放上修	N	1088	張玉山	三 2-4 和平 科技系TD301教室	
114	2	5	0	科學、科技、工程與數學整合教育研究 </br>[ 學分學程：理工實作學程 ]			9	9		ITM0093		半	3.0	科技系（碩）	HM71		Studies in Integrative Science, Technology, Engineering, and Mathematics Education </br>[ Program: The Program of STEM Innovation and Practices ]			3	30	選	◎限本系(含雙主修)修習 ◎課程開放上修	N	1089	林坤誼	一 7-9 和平 科技系TB211教室	
114	2	5	0	科技與工程教學評量研究			6	6		ITM0097		半	3.0	科技系（碩）	HM71		Studies in Evaluation for Technology and Engineering Instruction			0	30	選	◎限本系(含雙主修)修習◎必須先修過【ITM0095  科技與工程課程發展及評鑑研究】 ◎課程不開放上修	N	1090	游光昭	二 2-4 和平 科技系TB211教室	
114	2	5	0	企業招募與甄選			26	26		ITM0102		半	3.0	科技系（碩）	HM71		Corporate Recruitment and Selection			0	30	選	◎限本系(含雙主修)修習 ◎課程不開放上修	N	1091	陳淑媛	二 2-4 和平 科技系TA513教室	
114	2	5	0	組織行為專題研究	8		11	11		ITC8004		半	3.0	科技系（碩）	HM71		Studies in Organizational Behavior	是		0	30	選	◎限本系(含雙主修)修習 ◎課程不開放上修	N	1092	陳怡靜	四 7-9 和平 科技系TB211教室	
114	2	5	0	高等統計學（一） </br>[ 學分學程：商業分析學程 ]			33	33		ITM0006		半	3.0	科技系（碩）	HM71		Advanced Statistics (I) </br>[ Program: The Program of Business Data Analysis ]		1	0	35	必	◎限本系(含雙主修)修習 ◎課程不開放上修	N	1093	陳怡靜 張敬珣	五 2-4 和平 科技系TB211教室	
114	2	5	0	研究方法 （二）			32	32		ITM0086		半	3.0	科技系（碩）	HM71		Research Methods (II)		1	0	35	必	◎限本系(含雙主修)修習◎必須先修過【ITM0085  研究方法（一）】 ◎課程不開放上修	N	1094	陳怡靜	四 2-4 和平 科技系TB211教室	
114	2	5	0	書報討論（二）			26	26		ITM0084		半	2.0	科技系（碩）	HM71		Seminar (II)		2	0	30	必	◎限本系(含雙主修)修習◎必須先修過【ITM0083  書報討論（一）】 ◎課程不開放上修	N	1095	張敬珣	三 7-8 和平 科技系TB211教室	
114	2	10	0	印刷生產作業管理			4	4		GCM0011		半	3.0	圖傳系（碩）	HM72		Production Management of Printing		1	0	30	選	◎限本系(含雙主修)修習 ◎課程不開放上修	N	1096	廖信	二 8-10 和平 一般教室	
114	2	10	0	實驗統計設計			13	13		GCM0021		半	3.0	圖傳系（碩）	HM72		Experimental Design		1	0	30	選	◎限本系(含雙主修)修習 ◎課程不開放上修	N	1097	張伯謙	三 2-4 和平 綜701	
114	2	10	0	書報討論（二）			22	22		GCM0038		半	2.0	圖傳系（碩）	HM72		Seminar (II)		1	0	30	必	◎限本系(含雙主修)修習◎必須先修過【GCM0111  書報討論（一）】 ◎課程不開放上修	N	1098	王希俊	四 7-8 和平 綜701	
114	2	10	0	傳播科技文獻閱讀與寫作			13	13		GCM0082		半	2.0	圖傳系（碩）	HM72		Journal Article Reading and Writing in Communication Technology		1	0	30	選	◎限本系(含雙主修)修習 ◎課程不開放上修	N	1099	楊美雪	四 3-4 和平 綜701	
114	2	10	0	圖像防偽科技研究			4	4		GCM0086		半	3.0	圖傳系（碩）	HM72		Studies in Anti-Forgery Technology		1	0	30	選	◎限本系(含雙主修)修習 ◎課程不開放上修	N	1100	王希俊	一 7-9 和平 綜701	
114	2	10	0	影視傳播科技與法規研究			6	6		GCM0105		半	3.0	圖傳系（碩）	HM72		Tv/film Technology and Law		1	0	30	選	◎限本系(含雙主修)修習 ◎課程不開放上修	N	1101	劉立行	二 A-C 和平 新媒體專業教室	
114	2	10	0	圖像品質控制分析			4	4		GCM0018		半	3.0	圖傳系（碩）	HM72		Printing Quality Control and Analysis		2	0	30	選	◎限本系(含雙主修)修習  ◎限碩二碩三以上修習 ◎課程不開放上修	N	1102	廖信	一 2-4 和平 一般教室	
114	2	10	0	影像傳播科技專題研究			2	2		GCM0029		半	2.0	圖傳系（碩）	HM72		Special Topics in Graphic Communications		2	0	30	選	◎限本系(含雙主修)修習  ◎限碩二碩三以上修習 ◎課程不開放上修	N	1103	陳明秀	五 A-B 和平 綜701	
114	2	10	0	印刷出版科技專題研究			3	3		GCM0030		半	2.0	圖傳系（碩）	HM72		Special Topics in Graphic Arts and Publishing		2	0	30	選	◎限本系(含雙主修)修習  ◎限碩二碩三以上修習 ◎課程不開放上修	N	1104	廖信	一 A-B 和平 一般教室	
114	2	10	0	影視媒體與文化			10	10		GCM0035		半	2.0	圖傳系（碩）	HM72		Culture and Audio-Visual Media		2	0	30	選	◎課程不開放上修	N	1105	周守訓	三 9-10 和平 綜701	
114	2	10	0	印前科技專題研究			3	3		GCM0039		半	2.0	圖傳系（碩）	HM72		Special Topics in Advance Pre-press Engineering		2	0	30	選	◎限本系(含雙主修)修習  ◎限碩二碩三以上修習 ◎課程不開放上修	N	1106	王希俊	四 A-B 和平 綜701	
114	2	10	0	網際網路傳播專題研究			0	0		GCM0042		半	2.0	圖傳系（碩）	HM72		Special Topics in Internet Communications		2	0	30	選	◎限本系(含雙主修)修習  ◎限碩二碩三以上修習 ◎課程不開放上修	N	1107	周遵儒	四 A-B 和平 新媒體專業教室	
114	2	10	0	數位影像科技專題研究			4	4		GCM0044		半	2.0	圖傳系（碩）	HM72		Special Topics in Digital Image Processing		2	0	30	選	◎限本系(含雙主修)修習  ◎限碩二碩三以上修習 ◎課程不開放上修	N	1108	張晏榕	二 A-B 和平 綜701	
114	2	10	0	地方編輯			3	3		GCM0118		半	3.0	圖傳系（碩）	HM72		Local Editing		2	0	30	選	◎限本系(含雙主修)修習  ◎限碩二碩三以上修習 ◎課程不開放上修	N	1109	涂卉	二 2-4 和平 綜701	
